,article_body,category,city,date,heading,sentiment,link,paper
89,"Patna: Former Union minister and Nationalist Congress Party (NCP) general secretary Tariq Anwar on Monday called the Centres decision to demonetise Rs1,000 and Rs500 notes as immature and said it had been done without making any alternative arrangement to meet the monetary crisis being faced by the common man in the country.  There is no doubt that solid step was needed to combat the problem of black money, but it is also a fact that any major step has to be taken with considerable advance thinking. This, however, was not done, as a result of which common man has been facing immense hardship that none had anticipated, Anwar said. The partys state spokesman Anil Kishore Jha accompanied him.  Apparently, no application of mind was made on making alternative arrangements, nor was there any blueprint. The step has proved to be immature and taken in haste, he added.  To say that the demonetisation of Rs1,000 and Rs500 notes would finally end the circulation of black money in the country is just a chunawi jumla (election rhetoric), Anwar said. He added that Morarji Desai as PM had also demonetised Rs1000, Rs5,000 and Rs10,000 notes, which impacted the rich and powerful, but the impact of the present demonetisation has been felt mostly by common man.  Anwar also said PM Narendra Modi has demonetised the Rs1000 and Rs500 notes for political advantage with eye on the assembly elections to be held next year in five states, including Uttar Pradesh. Everything that Modi does is to gain political advantage during forthcoming assembly elections, whether it is surgical strike after Uri terror attack or any other thing. Even the demonetisation step was called surgical strike against black money, Anwar said.  He said the NCP had not yet decided to join the delegation led by West Bengal CM Mamata Banerjee to call on President Pranab Mukherjee, nor had NCP been extended an invitation for it. For our sake, the NCP had initially welcomed the demonetisation step to fight against black money, but the banking system has been paralysed and common man is faced with enormous difficulties, Anwar added.  He said plastic money is used only by five per cent of people, while bank branches have not yet covered majority of the rural population.  Anwar said the demonetisation decision would not help combat the parallel system of black money, as most of them who own it have kept it stashed in foreign banks and only a small percentage of the total black money was in circulation in the country.",city,patna,"Updated: Nov 14, 2016, 11.12 PM IST",Demonetisation a step in haste: Tariq,,http://timesofindia.indiatimes.com//city/patna/Demonetisation-a-step-in-haste-Tariq/articleshow/55422181.cms,toi
90,"LUCKNOW: For many kids in the city, Children's Day this year has turned dull with demonetisation affecting their plans. They had even saved money for the occasion but are now instead helping their parents with their savings.Eleven-year-old Aaraish Fatima had eagerly waited for November as two big celebrations were lined up: Children's Day on November 14 and the fete in her school. She had saved money in her small piggy bank in the home for the past few months. But all her plans awry as PM's demonetisation announcement came in November.With a heavy heart, Fatima broke her piggy bank into pieces and handed over the savings to her parents who had been frantically running for change from one bank to another. ""My parents did not ask me for money , but I wanted to help them, so I extended my piggy bank as help"" she said.To add to her woes, the school has postponed the fete in the wake of severe currency shortage in the city. ""The fete has been cancelled as the teacher said children would demand money from their parents for money and cash being an issue, it would create be problems in homes,"" Fatima added.Seven-year-old Anurag's story is no different. The little boy hopes to refill his piggy bank soon. He, too, broke his favourite yellow colour piggy bank. ""Somebody told me Rs 100 coins will be given to me. I am super excited for them and will also collect the new Rs 2000 notes now,"" he said.""I was saving up to buy a bayblade in the school fete, but I thought I could save up money again. My parents were really worried for any change in the past two days, so I decided to break my piggy bank down,"" said 12-year-old Darain Mehdi.",city,lucknow,"Nov 14, 2016, 11.58 AM IST",Demonetisation becomes a spoiler for Children's Day,,http://timesofindia.indiatimes.com//city/lucknow/Demonetisation-becomes-a-spoiler-for-Childrens-Day/articleshow/55411593.cms,toi
91,"Hours after  Prime Minister Narendra Modi announced the demonetisation of Rs. 500 and Rs. 1000 notes+  on November 8, Ajay Devgn was one of the first Bollywood celebrities to welcome the change. The actor had taken to Twitter to  laud PM Modi's bold move+  .    Six days since the policy came into effect, the common man and the film industry alike are  reeling under the cash drought+  . However, Ajay continued to express his support for the move. Calling it a 'historic step', the actor said, 'You really need guts to take a step like this; hats off as this will be beneficial in the long run.'      You really need guts to take a step like this; hats off as this will be beneficial in long run: Ajay Devgan    #DeMonetisationpic.twitter.com/uPeHeRvODQ    ' ANI (@ANI_news)    November 13, 2016  The actor added that he is aware that the decision has brought about a lot of discomfort for the common man. 'Even my film is suffering because of this but in front of nation's interest, I find this inconvenience trivial. I want to request people to not panic; there is  time till December 30+  . People who're not in desperate need for money can wait a bit.'      Even my film is suffering because of this but in front of nation's interest, find this inconvenience trivial: Ajay Devgan    #DeMonetisationpic.twitter.com/UbEUcBFC5Y    ' ANI (@ANI_news)    November 13, 2016  Citizens across the nation have been facing inconvenience but Ajay pointed out that one should look at the bigger picture. Ajay said, 'Whenever change takes place, common man faces problem; people from my office are standing in queues and willing to face problems for better future.'      Whenever change takes place,common man faces prob;ppl frm my office are standing in queues&willing to face problems for better future-Devgan        ' ANI (@ANI_news)          November 13, 2016",entertainment,,"Updated: Feb 27, 2017, 12.37 AM IST",Ajay Devgn on demonetisation: Inconvenience trivial in front of nation's interest,,http://timesofindia.indiatimes.com//entertainment/hindi/bollywood/bollywood-news/Ajay-Devgn-on-demonetisation-Inconvenience-trivial-in-front-of-nations-interest/articleshow/55411721.cms,toi
92,"Randeep Hooda is the latest actor to join the chorus of Bollywood celebrities, singing praises of PM Modi's demonetisation initiative. At a time when tempers of the common man have reached the tipping point, Randeep plead with the Indian citizens to co-operate with the government as this move is 'for the better'.    Addressing the media, Randeep said, 'There is inconvenience to everybody, but this is for the better. Urge everyone to co-operate, we should be with the government.'    Amidst all the discouraging messages that are being circulated on several social networking platforms against the execution of currency exchange, Randeep has been doing his part to spread a little positivity by re-tweeting pictures of his fans and followers. The actor also hit back at haters by posting a series of tweets saying, 'I'm disappointed by all these fraudulent people who want change, but, don't want any inconveniences that come with it #IndiaFightsBlackMoney.'    He also tweeted the following:      Is the job of Everyone not in power to undermining every action by the Govt.Who's thinking of the nation?    #nationfirst#IndiaFightsBlackMoney    ' Randeep Hooda (@RandeepHooda)    November 13, 2016    The nation has 50 days.Why is this panic being created? Daily wage workers and the so called poor that are suffering are not on social media        ' Randeep Hooda (@RandeepHooda)    November 13, 2016    So are we ??    https://t.co/718teqn13O    ' Randeep Hooda (@RandeepHooda)    November 13, 2016    All I want to say is: these are trying times but it's for a better country.Lets help each other and not panic    #india#IndiaFightsCorruption    ' Randeep Hooda (@RandeepHooda)    November 13, 2016    Lets make for a better tom. Help those who are making a diff. Like this man! If you know anyone helping do let us know    #HeroesWithoutMakeuppic.twitter.com/FHaLuF43dt    ' Randeep Hooda (@RandeepHooda)    November 13, 2016",entertainment,,"Updated: Jan 29, 2017, 06.06 AM IST",Randeep Hooda urges people to co-operate with government on demonetisation drive,,http://timesofindia.indiatimes.com//entertainment/hindi/bollywood/bollywood-news/Randeep-Hooda-urges-people-to-co-operate-with-government-on-demonetisation-drive/articleshow/55411878.cms,toi
93,"Prime Minister Narendra Modi announced the demonetisation of Rs. 500 and Rs. 1000 notes on November 8 in a bid to curb corruption and black money. While the decision has brought about a cash drought of sorts, it has also gravely affected the film industry.    One of the films that has got get affected in the process is Ajay Devgn's 'Baadshaho'. The shoot of the Milan Luthria-directed film has been postponed from November 19 to November 29. The decision to push the shoot by 10 days was arrived at since payments to junior artistes are made in cash on a daily basis and without them, the workflow is affected. Hence, the makers felt it would be wiser to start shooting when things settle down.    Confirming the news to a daily, Milan said that his production team was making arrangements for daily payments and that they would be adapting to the current situation quickly. The director also appreciated the support he received from the team including Ajay, Emraan Hashmi, Esha Gupta, Vidyut Jamwal and Ileana D'Cruz who were forthcoming in reworking dates despite last minute changes in schedule.    The delay of his film notwithstanding, Ajay has been vocal in his support for the demonetisation policy.",entertainment,,"Updated: Feb 27, 2017, 12.37 AM IST","Demonetisation delays the shoot of Ajay Devgn's next, 'Baadshaho'",,http://timesofindia.indiatimes.com//entertainment/hindi/bollywood/bollywood-news/Demonetisation-delays-the-shoot-of-Ajay-Devgns-next-Baadshaho/articleshow/55412650.cms,toi
94,Here are the latest on whats been done to ease the pain of the currency demonetization for the public.,entertainment,,"Updated: Jan 29, 2017, 06.08 AM IST",Prakash Jha on demonetisation: The idea deserves a chance,,http://timesofindia.indiatimes.com//entertainment/hindi/bollywood/bollywood-news/Prakash-Jha-on-demonetisation-The-idea-deserves-a-chance/articleshow/55412898.cms,toi
95,"BEIJING: Terming Prime Minister Narendra Modi's decision to  demonetise high value currency notes+  as ""startling and bold"", Chinese official media has said it is ""far from enough"" and India may ""look at ideas"" from China's crackdown against corruption which has shown ""efficiency"".    Modi in ""a startling and sudden move"" demonetised Rs 500 and Rs 1,000 currency notes to ""demonstrate that he is truly up for a fiercer  fight against black money and corruption+  "", an op-ed article in the state-run Global Times said.    ""Modi means well and his decision was made based on the reality in India, since most illegal business in the underground economy is cash-only, and 500 and 1,000 rupee notes constitute over 80 per cent of all cash circulation in India. Nevertheless, we can hardly count on the new rule to fully root out corruption,"" the article titled 'Beijing offers clues for Modi's new anti-corruption moves'.    Since Modi assumed office, he has carried out a number of measures to crack down on black money, corruption and tax evasion. However, many of them are believed to be ""without teeth and can't begin to scratch the surface of the problems he faces"", it said.    India's new policy to scrap high value notes is considered a ""risky, but a bold and decisive step"", it said.    ""And yet, delivering a corruption-free country requires more than banning currency notes. The key should be reforming systems. In this regard, New Delhi might need to look for ideas from Beijing,"" it said, referring to the massive anti- graft campaign carried out by President Xi Jinping in which over a million officials at different levels were punished.    Since the 18th National Congress of the Communist Party in 2012, during which Xi was elected as its general secretary, and taking over as the President and military chief launched the anti-graft campaign which also attracted criticism that he used it effectively to consolidate his power emerging as the most powerful Chinese leader after party founder Mao Zedong.    ""Over the years, China promoted anti-corruption laws, improved the supervision system, deepened judicial system reforms and adopted measures to make sure the system is transparent,"" it said without referring to criticism about the campaign.    ""For instance, China's foreign ministry has lately published information about the families of 12 senior officials on its website in an effort to fight against corruption through familial networks by improving transparency. These steps are taken to ensure that achievements made in the struggle against corruption can be consolidated by laws and systems,"" it said.    China is still on its way toward building a comprehensive anti-corruption system. But ""compared with India, Beijing's method has already shown its efficiency"", it said.    ""More time is needed to see whether Modi's new policy will turn into a huge blow against corruption in India. The hard truth is that the corrupt and fraudulent won't just conduct shady deals by using cash, but with gold, real estate and overseas assets.    ""Corruption can be bred in a variety of ways. Blocking the circulation of large currency bills is without question far from enough,"" it said.",india,,,Demonetisation: Steps taken to ease cash crunch,,http://timesofindia.indiatimes.com//india/Demonetisation-Steps-taken-to-ease-cash-crunch/articleshow/55412922.cms,toi
96,"BEIJING: Terming Prime Minister Narendra Modi's decision to  demonetise high value currency notes+  as ""startling and bold"", Chinese official media has said it is ""far from enough"" and India may ""look at ideas"" from China's crackdown against corruption which has shown ""efficiency"".    Modi in ""a startling and sudden move"" demonetised Rs 500 and Rs 1,000 currency notes to ""demonstrate that he is truly up for a fiercer  fight against black money and corruption+  "", an op-ed article in the state-run Global Times said.    ""Modi means well and his decision was made based on the reality in India, since most illegal business in the underground economy is cash-only, and 500 and 1,000 rupee notes constitute over 80 per cent of all cash circulation in India. Nevertheless, we can hardly count on the new rule to fully root out corruption,"" the article titled 'Beijing offers clues for Modi's new anti-corruption moves'.    Since Modi assumed office, he has carried out a number of measures to crack down on black money, corruption and tax evasion. However, many of them are believed to be ""without teeth and can't begin to scratch the surface of the problems he faces"", it said.    India's new policy to scrap high value notes is considered a ""risky, but a bold and decisive step"", it said.    ""And yet, delivering a corruption-free country requires more than banning currency notes. The key should be reforming systems. In this regard, New Delhi might need to look for ideas from Beijing,"" it said, referring to the massive anti- graft campaign carried out by President Xi Jinping in which over a million officials at different levels were punished.    Since the 18th National Congress of the Communist Party in 2012, during which Xi was elected as its general secretary, and taking over as the President and military chief launched the anti-graft campaign which also attracted criticism that he used it effectively to consolidate his power emerging as the most powerful Chinese leader after party founder Mao Zedong.    ""Over the years, China promoted anti-corruption laws, improved the supervision system, deepened judicial system reforms and adopted measures to make sure the system is transparent,"" it said without referring to criticism about the campaign.    ""For instance, China's foreign ministry has lately published information about the families of 12 senior officials on its website in an effort to fight against corruption through familial networks by improving transparency. These steps are taken to ensure that achievements made in the struggle against corruption can be consolidated by laws and systems,"" it said.    China is still on its way toward building a comprehensive anti-corruption system. But ""compared with India, Beijing's method has already shown its efficiency"", it said.    ""More time is needed to see whether Modi's new policy will turn into a huge blow against corruption in India. The hard truth is that the corrupt and fraudulent won't just conduct shady deals by using cash, but with gold, real estate and overseas assets.    ""Corruption can be bred in a variety of ways. Blocking the circulation of large currency bills is without question far from enough,"" it said.",world,,"Updated: Nov 14, 2016, 02.39 PM IST",Demonetisation move 'bold' but far from enough: Chinese media,,http://timesofindia.indiatimes.com//world/china/Demonetisation-move-bold-but-far-from-enough-Chinese-media/articleshow/55413147.cms,toi
97,"CHENNAI: DMK on Monday raised doubts about a statement that AIADMK leader and Tamil Nadu chief minister J Jayalalithaa issued on Sunday in which she appealed to people in Thanjavur, Tiruparankundram and Aravakurichi constituencies to vote for the party.    ""The chief minister has not spoken about the sufferings of the people caused by demonetisation of currency notes. She has only sought votes from the people in the three constituencies. Why has the chief minister not spoken about the sufferings of people if she has issued the statement? Or, has the statement been issued by people who have been acting behind the scenes for the past 50 days,"" asked DMK treasurer and leader of the opposition M K Stalin on Monday.    In a statement, Stalin said poor and middle class people were suffering by standing in long queues in front of banks. ""Even after getting the new Rs 2,000 note, it is as well not having any money as the currency could not be exchanged due to shortage of currencies in lower denominations,"" he said.    ""Many are not able to purchase rice, milk and other essential commodities due to the demonetisation. When the chief minister states that she is for the people, a question arises -- why has she not mentioned anything about people's sufferings in her statement,"" Stalin said.",india,,"Updated: Nov 14, 2016, 02.39 PM IST",Demonetisation move 'bold' but far from enough: Chinese media,,http://timesofindia.indiatimes.com//india/Demonetisation-move-bold-but-far-from-enough-Chinese-media/articleshow/55413145.cms,toi
98,"Over the last few days, Bollywood stars have been expressing their support for Prime Minister Narendra Modi's demonetisation policy. No sooner had the PM announced the demonetisation of Rs. 500 and Rs. 1000 notes on November 8 than many stars took to Twitter to hail the decision.  Hrithik Roshan is the latest celebrity to lend his support to the policy. The actor said, 'I salute our PM. This is radical but it's a first step to his promise of eradication of malpractices. It will also rein in counterfeiters. Bravo!!'    Of course, the 'Kaabil' actor was well aware of how the decision has caused inconvenience to the daily lives of citizens. Keeping this into account, Hrithik pointed out that this is a necessary step to curb black money and people will probably understand its benefits only in hindsight. He stated, 'Every bold and inspirational move is initially met with resistance. It's only in hindsight that people will appreciate the strength of this move against black money.'",city,chennai,"Nov 14, 2016, 01.51 PM IST","Why didnt Jayalalithaa speak about peoples sufferings caused by demonetisation, asks Stalin",,http://timesofindia.indiatimes.com//city/chennai/Why-didnt-Jayalalithaa-speak-about-peoples-sufferings-caused-by-demonetisation-asks-Stalin/articleshow/55413298.cms,toi
99,"MADURAI: More than a hundred employees of Primary Agricultural Cooperative Banks in Madurai and Theni districts under the aegis of Tamil Nadu Primary Cooperative Bank All Employees Association staged a demonstration in front of the Madurai District Central Cooperative Bank here on Monday. They stated that all banking activities in PACBs have come to a standstill due to demonetisation of Rs 500 and 1000 currencies.    According to the association, all the 4654 PACBs in the state have received oral instructions to suspend transactions after the RBI sent out a circular on demonetisation of Rs 500 and 1000 notes. Due to the order they are not able to carry out any services to the beneficiaries of PACBs.    They are not able to accept dues of various loans taken in cooperative banks by farmers or dispense cash from savings accounts of them. Interest and dividends could not be distributed to farmers. They are not able to return the jewels pledged in cooperative banks when farmers having some family functions try to redeem their jewels.    Unable to render any services or answer the queries of anxious farmers, they closed down all PACBs on Saturday and handed over the keys to cooperative registrars in concerned districts. All PACBs were closed on Monday.    ""In addition to carrying out cash transactions, PACBs also involve in distributing fertilisers to farmers and run Public Distribution Shops for poor people. All the activities have come to a standstill due to the oral order from government"", said P Kamaraj Pandian, state Joint Secretary of the association.    The employees urged government either to revoke the oral order allowing them to transact with old denomination currencies temporarily or issue new currency notes to resume operations. ""We have decided to demand the supply of cash in new denominations. Till the cash is distributed to PACBs, we appeal government to announce that all PACBs won't function"", he added.",entertainment,,"Updated: Jan 29, 2017, 06.07 AM IST",Hrithik Roshan on demonetisation: I salute our PM for the inspirational move,,http://timesofindia.indiatimes.com//entertainment/hindi/bollywood/bollywood-news/Hrithik-Roshan-on-demonetisation-I-salute-our-PM-for-the-inspirational-move/articleshow/55413747.cms,toi
