,article_body,category,city,date,heading,sentiment,link,paper
147,"VADODARA: From small businesses to citizens, all have been hit by the demonetization decision of the government. People have been queuing up for hours at banks to get their currency notes of Rs 500 and Rs 1,000 denomination exchanged or deposit. But the eunuch community that is settled in Baranpura and collects around Rs 7.5 lakh every month in cash has no reasons to panic.    The eunuchs had been planning to build a temple of Bahucharaji deity since past few years in Wadi. The construction started more than a year ago and it ended a few months back. Coincidentally, the community members paid cash to the contractor who built the temple a few days before currency notes of Rs 500 and Rs 1,000 were invalidated. The community had also organized an inauguration function of the temple on November 14 that was attended by deputy chief minister Nitin Patel. ""Whatever savings all members had, we gave it for the construction of the temple and the inauguration function,"" said Anju Kunwar, a eunuch of the community.    She added that they had been preparing for the function since two months and had made advance payments to all suppliers. Therefore, they do not have enough cash in the form of Rs 500 and Rs 1,000 denomination.    After demonetization, the eunuchs have decreased their visits to give their blessings. ""We have stopped visiting homes of new born children and newly married couples. Even if some members visit, they do not take cash and ask the families to call them after situation normalizes,"" said Asha Kunwar who heads the Baranpura akhada.",india,,"Updated: Nov 17, 2016, 04.04 AM IST","It's like labour pain, a big joy on way for nation, government on demonetisation",,http://timesofindia.indiatimes.com//india/Its-like-labour-pain-a-big-joy-on-way-for-nation-government-on-demonetisation/articleshow/55466398.cms,toi
148,"VISAKHAPATNAM: One week after the demonetisation drive was launched, fish prices have nosedived by nearly 60 per cent at various landing centres of the district.    According to sources, more than 90 per cent of the motorised boats in the fishing harbour have been anchored due to the low rates prevailing for fish and also due to the difficulties being faced in procuring fuel for the boats. At the same time, sources said fisherwomen who are mainly involved in door-to-door sale of fish in the district are bearing the brunt of demonetisation as they are unable to get their hands on lower denominations for a smooth trade. More than 13,000 fisherfolk have been affected due to the lack of lower denominations in the district, the sources said.    While king fish normally sold at around Rs 600 per kilo, it now sells for Rs 200-250 per kilo, while the price of seer fish has dropped from Rs 350 per kilo to Rs 150-200. Also, rates of croaker fish, ribbon fish and goat fish have dropped from the normal rates of Rs 60-70 per kilo to Rs 35-40.    Speaking to TOI, District Fishermen's Youth Welfare Association executive secretary Arjilli Dasu said, ""The main demand is for Rs 100 and Rs 50 notes and there is lack of these notes at the fish landing areas in the district. Many fisherwomen were able to exchange the old Rs 500 and Rs 1,000 notes, but in turn they got only Rs 2,000 notes which are useless as of now for the trade.""    Furthermore, he said, ""On normal days, you have around 10-15 tonnes landing at the fishing harbour, but now only 5-6 tonnes is coming in. Due to the low loads the prices should actually have been higher, but as there is no lower denominations, nobody is buying. Even dry fish rates have dropped from the normal Rs 50-60 per kilo to Rs 30-35 per kg.""    Concurring that lack of lower denominations was hurting the fishing industry which usually witnesses a turnover of around Rs 4 crore per day in the district, Visakha Dolphin Boat Owners Association president Ch Satyanarayana Murthy said, ""Nobody has lower denominations in the market. Whatever fish is coming in is not being sold and even if the fisherfolk are able to sell it, they are getting very low rates. The unsold fish are being dried. Boat owners are also facing huge problems because of restrictions on cash withdrawals. While the literate people can use RTGS for money transfer to fuel the boats, the others are not able to do it. More than 90 per cent of the boats are in the jetty because nobody has the required money to go to the sea.""    He said, ""We need Rs 50 and Rs 100 denominations for trade to normalise in the fishing harbour. Without this, even the vendors and rickshaw pullers are not able to do business normally.""",city,vadodara,"Updated: Nov 17, 2016, 07.35 AM IST",Eunuchs unscathed by demonetization,,http://timesofindia.indiatimes.com//city/vadodara/Eunuchs-unscathed-by-demonetization/articleshow/55464275.cms,toi
149,"NEW DELHI: The opposition united on Wednesday to attack the Modi government, saying that demonetisation of Rs 500 and Rs 1,000 notes had unleashed ""economic anarchy"", subjected common people to hardship and disrupted trade and business.    Members of Congress, Left, BSP, JD(U) and SP, while not demanding a rollback Banks cut deposit, loan rates as liquidity rises, P 21 like Trinamool leader Mamata Banerjee, lashed out at the government on the first day of the winter session. Claiming that information about scrapping of high denomination notes was ""leaked"", they demanded the constitution of a joint parliamentary committee to examine the alleged breach of secrecy .    Opening the opposition attack, Congress's Anand Sharma said housewives queueing up at banks and ATMs could not be seen as holders of black money and criticised the government for seeking to tar all critics of demonetisation as ""anti-national"". He claimed BJP had been reduced to parroting PM Modi's lines.    BSP chief Mayawati said the government was attacking opposition parties in order to hide its own failures.She said her party was a movement that collected funds from common people and not from millionaires or overseas patrons. SP's Ram Gopal Yadav warned that BJP would face the wrath of its core voters.    Responding to the opposition, ministers Piyush Goyal and Venkaiah Naidu mounted a strong defence, ruling out any concession by way of allowing use of old currency beyond the permitted excep tions. Goyal said the bold decision forcefully buries allegations that the Modi government was for big business while Naidu said people were willing to put up with some pain for future gain.    Goyal said demonetisation showed that if anyone had the strength to take on black money and corruption, it was the Modi government. He added that initial difficulties were due to the need for secrecy.    No honest taxpayer would lose a single rupee while those with unaccounted wealth and terror organisations thriving on extortion would suffer, said Goyal. CPM's Sitaram Yechury supported the action ag ainst black money , but said only 6% of such money in India is in cash. He added that demonetisation would not curb illicit wealth. Raising doubts whether the government move would put an end to black money , Yechury said, ""The PM is cleaning the pond to kill the crocodile. Crocodiles can survive outside water, but small fish are dying... It is no longer Jai Hind, PM appears in ads and says Jio Hind.""    Congress's Pramod Tiwari caused a mini-flutter by stating that Modi has joined the league of leaders like Hitler, Mussolini and Gaddafi who also demonetised currency in their country . ""No civilised nation has done this,"" he said, causing an immediate protest from Ravi Shankar Prasad.    Earlier, Anand Sharma wondered why the government has turned 86% of currency illegal when by its own admission only 0.02% currency notes are fake. ""This is some kind of an undeclared Emergency ,"" he said.    Mayawati said the PM had not undertaken sufficient measures during the 10 months of preparation for demonetisation to ensure that people did not suffer. She alleged the government took all this time to channelise the high-value currency notes of BJP and to give a hint to the rich to take care of their deposits. Rival SP's Ram Gopal Yadav said the situation is worse than Emergency when at least food was available.    JD (U) member Sharad Yadav said demonetisation has resulted in distress sale of paddy in villages and farmers are unable to buy seeds and fertilisers.    Maintaining that the country is tired of Modi's theatrics, be it his claim that he renounced his family to serve the nation or that people want to kill him, Sharma said, ""He changes clothes five times a day and says he has renounced everything. As for threat to his life it is a serious matter and nation should know who wants to kill him.""",city,visakhapatnam,"Updated: Nov 17, 2016, 08.16 AM IST",Fisherfolk caught in demonetisation net,,http://timesofindia.indiatimes.com//city/visakhapatnam/Fisherfolk-caught-in-demonetisation-net/articleshow/55464084.cms,toi
150,"LUCKNOW: The demonetisation policy has come as blessing in disguise for money exchange touts. An unorganised network of touts has been operating in the city for many years thanks to traders who required Rs 100 5001,000 note to operate in smaller markets and also to distribute it to workers.They charge a small sum for exchanging but in the current crisis the rate has risen to over 30%.    It was business as usual for Asharam Majhi, hailing from Katihar, Bihar, a grocery store owner in HAL market for past five years till the decision on currency notes.""I used to exchange Rs 500 notes for smaller currency at Rs 25 each from a local tout but on November 10 he said I will get only Rs 700 in exchange of a Rs 1,000 note,"" he told ToI. He added there was acute crisis at his home too. ""I have not been able to make a call to my family and now this loss of Rs 300,"" he said.    In the similar vein, Vijay Gupta, who owns a jewellery store in Sarvodaya Nagar locality of the city said, ""I used to bring change of Rs 100 in coins, for an extra Rs 2, but now the tout has increased his rate and has started taking Rs 10 extra. He added that the tout now claims to be a financial risk analyst.    Wholesale food-grain-seller R K Shukla said, ""I fear my business will perish as I used to take change of Rs 500Rs1000 at Rs 25 but now the rate has risen, while the biggest challenge will be acquiring change of Rs 2,000 note. Will touts charge Rs 600 for it,"" he said, adding, ""How will I pay labours, transporters? Unable to sleep, my blood pressure has shot up,"" said Shukla.    A K Rastogi, involved in business of ""changing money"" said on grounds of anonymity said, ""Just look at the queues, so why should we not increase our commission.    Mushtaq said, ""I have more than 50 coins of Rs 10 but people are not ready to take them, saying they are fake. Is there any guideline issued by banks identifying which coin is fake and which is genuine,"" he said.",india,,"Nov 17, 2016, 06.11 AM IST","It's 'economic anarchy', opposition on demonetisation",,http://timesofindia.indiatimes.com//india/Its-economic-anarchy-opposition-on-demonetisation/articleshow/55467155.cms,toi
151,"NEW DELHI: There is a sense of deja vu about the queues, catcalls, grumbling and the dejection at the banks and ATMs. There is also an exhausted air around the whole exercise, as people continue to be put to the test in trying to grab their cash.    Nigar Sultana's son tried to get the promised Rs 4,000 for four days. Failure brought his mother, a resident of Old Delhi, to the bank on Wednesday . After four hours in the line, the 54-year-old said, ""I was forced to come here today because we now need cash urgently . This is despite my health not allowing me to stand like this for long hours.""    The day brought new frustrations for expectant people like her. Reserve Bank of India's (RBI) directive on using indelible ink to mark the fingers of those availing the exchange meant that many banks did not supply the acceptable currency notes for lack of the ink.    The Central Bank of India branch in Gulmohar Park, for one, had many complainants, many of whom pleaded in vain with the bank volunteers to relax the rule. There were few who could triumph in their inked finger, among them a handful at Jor Bagh's Dena Bank.    Under the circumstances, people continued to be denied their money . Vinod Kumar, a youngster who works in a south Delhi restaurant, began his stake out at the SBI branch at Old JNU Campus at 6am, desperate and determined after having failed to get any cash there on three earlier days or at two other banks in the locality.    Kushi Ram, a guard at an HDFC branch in Old Delhi, is a victim of such persistence. He hasn't gone home in five days for fear of people setting up beds at the bank entrance.    People are also coming to are as in the city that they think are better serviced by banks than their localities.    Such thoughts brought Minakshi Bansal and her husband to Hauz Khas from Usmanpur, the latter forced to apply for leave at his workplace to make the trip. Computer operator Si nod Kumar Kamat came from Faridababd to the SBI branch at Green Park with his 9-month-old daughter and wife, who stood in the women's queue to have better odds at getting to the exchange counter.    Mohammad Faizan and three family members were at Jor Bagh because getting money for his sister's marriage was proving almost impossible in Old Delhi.",city,lucknow,"Nov 17, 2016, 06.54 AM IST",Demonetisation a blessing in disguise for touts in city,1,http://timesofindia.indiatimes.com//city/lucknow/Demonetisation-a-blessing-in-disguise-for-touts-in-city/articleshow/55467423.cms,toi
152,"KANPUR: The demonetisation, which has also effected the farming practices, may result in a hike in wheat prices in future.    Farmers are unable to purchase seeds, necessary fertilizers and other important things in absence of lower denomination currency notes, delaying the sowing of wheat crop. And the delay may bring a rise in wheat rates ultimately increasing the prices of various food items.    In north India the best time to sow wheat crop is from November 1 to 10 and if it is delayed till December 10 then both the quality and yield get affected.    ""This is the perfect time to sow seeds for wheat crop to yield the best quality but as we have no money in lower denomination currency notes it would be delayed. The delay will result in bad quality and low yield,"" said farmer Dhram Singh, a resident of Gagan Kheda village, Sarsaul, Kanpur.    ""Though one can sow wheat crop till December 15 but the prime time is between November 1 and November 20. The productivity in such land where seeds will be sown late will degrade. On every one acre of land there would be a loss of five to seven quintals of the crop,' he added.    Another elderly farmer of the same village, Surendra Singh Yadav said, ""We dont have new currency notes to buy seeds and fertilizers to sow wheat crop. We are getting only old currency notes from wholesalers by selling seasonal vegetables With the limit of only Rs 4,000 to exchange at a time and now indelible ink, how will we exchange big amount which is required when ATMs too are dispensing only Rs. 2000 that too after struggling for entire day.""    Agriculture experts have also claimed that demonetization will certainly affect the agriculture cycle which is totally depended on perfect timing of sowing crops.    Dr Karam Hussian from Agronomy department of Chandra Shekhar Azad Univeristy of agriculture and technology said at present there is a decline in the purchase of seeds from the seed store of university. From a sale of three lakh rupees per day of seeds, it has come down to around one lakh. Also If wheat is sown in December month, there would be a decline of 10 to 12 quintal of crop per acres, he added.    He also advised farmers to increase the quantity of seeds for sowing and do proper irrigation if they sow seeds in December.    ""But this finally will hike the price of the wheat,"" he added further.",city,delhi,"Updated: Nov 17, 2016, 08.43 AM IST",Currency demonetisation: Spirits sink further as queues get longer,-1,http://timesofindia.indiatimes.com//city/delhi/Spirits-sink-further-as-queues-get-longer/articleshow/55468019.cms,toi
153,"MUMBAI: The money flooding into banks as people rush to deposit Rs 500 and Rs 1,000 notes has resulted in such a massive bonanza that it's pulling rates down, bankers said. Thus the longstanding complaint of the Reserve Bank of India (RBI) that banks weren't passing on rate reductions may be addressed soon.    Banks ran out of currency in the Capital and elsewhere, although some cities reported that queues had shortened. In Parliament, the opposition parties attacked the government over the withdrawal of Rs 500 and Rs 1,000 notes, saying it was insensitive, caused hardship to people and had unleashed ""economic anarchy"".    State Bank of India (SBI) reduced rates on deposits from one year to 455 days to 6.90%, down 15 basis points, while keeping the 7% rate for deposits between 211 days to one year unchanged. That may not be great news for those putting their money in banks but lending rates are likely to follow suit in a few weeks, possibly giving sluggish credit expansion a much-needed boost and shoring up growth. Abasis point is 0.01percentage point.    ""All rates will fall,"" said SBI Chairman Arundhati Bhattacharya. ""The bank has seen huge inflow of deposits but demand for credit has slowed down. Therefore, lending rates too will fall but after a gap.""    Since Prime Minister Narendra Modi announced that Rs 500 and Rs 1,000 were being scrapped from November 9 as part of the push against black money, counterfeiting and corruption, it's estimated that the banks have collected deposits worth a total Rs 4 lakh crore. To put that number in perspective, the government told the Supreme Court on Tuesday that it expected close to Rs 10 lakh crore to be deposited in banks by the end of December 30, which is when they will stop exchanging the old Rs 500 and Rs 1,000 notes. Deposits collected by State Bank of India and its five associate banks amounted to Rs 1 lakh crore until Wednesday.    SBI and its units make up about a fourth of the banking system. Among private banks, Axis Bank took the lead by cutting lending rates by 15-20 basis points.    The bank will charge 9.05% on one-year loan, which is higher than 8.90% by SBI, the country's largest bank.    Executives at Punjab National Bank, Bank of Baroda and Bank of India told ET they would be looking at cutting deposit rates soon.    According to RBI data, total deposits in the system are close to Rs 100 lakh crore. A Rs 4 lakh crore addition to this base is equivalent to the cash reserve ratio, the slice of deposits that banks have to park with the central bank.    ""This kind of deposit collection is as good as a cut in CRR by 4% and this will lead to interest rate transmission without a cut in policy rates,"" said R Marathe, managing director and CEO of Bank of Maharashtra.    CRR is currently at 4%. In the past few years, RBI has nudged banks several times to pass on cuts in key rates to end customers.    Former RBI governor Raghuram Rajan made the point repeatedly during his tenure.    Shubhada Rao, chief economist, Yes Bank, said: ""We expect banks to reduce deposit rates by 75-100 bps over the next six-nine months. The new regime of MCLR will immediately take into account the lower cost and will thereby lead to a decline in lending rates and improved transmission."" Marginal Cost of Funds based Lending Rate, or MCLR, is the methodology introduced by RBI last year that banks use to set rates.",city,kanpur,"Updated: Nov 17, 2016, 08.19 AM IST",Demonetisation may lead to rise in wheat price,-1,http://timesofindia.indiatimes.com//city/kanpur/Demonetisation-may-lead-to-rise-in-wheat-price/articleshow/55468034.cms,toi
154,"NEW DELHI: Tourism Minister Mahesh Sharma may say there's no crisis, but his ministry is flooded with representations and complaints on the chaos triggered by demonetisation in peak tourist season.""The Incredible India slogan is being talked of so very mockingly. The foreign tourist is unable to spend his money, shop or buy a drink, or hire a taxi,"" Pronab Sarkar, head of the Indian Association of Tour Operators, told ET.His outfit has made a detailed representation to the ministry, saying that ""foreign tourists should not suffer...feel cheated"". India attracts maximum number of foreign tourists in November and December. Last year, the figure touched 1.7 million during these months. Large numbers have pre-booked tours this year as well, with the sector anticipating a major bump up in numbers. But the tourism minister is unfazed. ""We took it up with the finance ministry and old currency is permitted till November 24 at ASI (Archaeological Survey of India)-protected monuments. I cannot say at this point what will be done after that. However, it is not a crisis situation. Foreign tourists may be facing some cash crunch, but it isn't that big a problem as most of them use credit cards,"" Sharma told ET.But operators want more steps. They have urged that demonetised currency be allowed beyond November 24, until swipe machines are in place at monuments and museums. They also want the exchange ceiling to be relaxed for foreign tourists and have suggested that scrapped notes be accepted for road tax by state governments. ""This is right in the middle of the Pushkar fair, which draws huge number of international tourists. But more than the timing, it's the mismanagement,"" Sarkar said. ""All payments have come to a standstill, leaving us in a big soup. The limit to withdraw Rs 50,000 per week is nothing for a tour company which has to make many small-value cash payments  ranging from guides to entry tickets,"" he added.Marzban Antia of the Travel Agents Association of India said the industry will take months from recover from the ""shock"". ""I don't see any kind of recovery right up to April or even July. Travel, hospitality to hotel occupancy  everything has been hit. We are still to assess the full impact. They should have injected enough Rs 2,000 and Rs 500 notes. That's where the government has not managed to get things back together. India is not yet ready to survive on just plastic money,"" Antia told ET.",business,,"Updated: Nov 17, 2016, 08.41 AM IST",Demonetisation: Massive deposit bonanza for banks pulls down interest rates,,http://timesofindia.indiatimes.com//business/india-business/Demonetisation-Massive-deposit-bonanza-for-banks-pulls-down-interest-rates/articleshow/55468339.cms,toi
155,"JAIPUR: The Rajasthan unit of the Communist Party of India-Marxist in a press on Wednesday said it would join other organizations in protesting Prime Minister Narendra Modi's poorly planned move to demonetize the Rs 500 and Rs 1,000 currency notes. The protest will be held at 3 pm at Shaheed Smarak in the state capital.Poor people are being made to stand in long, winding queues outside banks and ATMs to access their own hard-earned money. This ""Tughlaki farman"" an order reminiscent of Mohammand bin Tughlak, who served as Sultan of Delhi 1324-1351, is putting people to enormous hardship, the CPI-M said in its press release, adding that the Centre should allow people to use the old notes until fresh ones are printed in adequate quantity and properly distributed.CPI-M alleged that the government has made this announcement only to deflect attention from the Rs11 lakh crore that corporate houses owe banks.",business,,"Nov 17, 2016, 10.07 AM IST",Demonetisation: Tourism industry knocks at govt doors with bag of woes,-1,http://timesofindia.indiatimes.com//business/india-business/Demonetisation-Tourism-industry-knocks-at-government-doors-with-bag-of-woes/articleshow/55469722.cms,toi
156,"GUWAHATI: The demonetization of Rs 500 and Rs 1000 currency notes has posed a hurdle in serving midday meals in schools of Assam as there is scarcity of cash in buying food items for the purpose.    At present, midday meals are served to 32 lakh students in 56,000 government-run schools of the state.    As teachers can't afford to spend their valuable time queuing up in banks and ATMs for cash, the money to buy food is slowly drying up. ""In many sub-divisions of the state, schools are spending money very carefully because the teachers can neither wait in queue to withdraw money from banks, nor can they spend their valuable time in exchanging higher denomination currency notes for buying food for children,"" said Jiban Chandra Borah, president of Assam State Primary Teachers' Association.    Though the Food Corporation of India (FCI) supplies rice to government-run schools for cooking midday meal, vegetables and other necessary items need to be bought for cooking food. However, sources in the education department said proper implementation of midday meal scheme is top priority of the government.    Apart from teaching, the teachers have to manage midday meals for students up to Class 8. ""Buying pulses, mustard oil and other food items is a costly affair nowadays. It is very difficult to have Rs 100 or other lower denomination currency notes in stock for buying commodities required to serve meal to hundreds of students,"" said the headmaster of a school in Golaghat.",city,jaipur,"Nov 17, 2016, 10.17 AM IST",CPI-M to protest against demonetisation move today,-1,http://timesofindia.indiatimes.com//city/jaipur/CPI-M-to-protest-today/articleshow/55464895.cms,toi
