,,,,,,
,NATIONAL ELECTRONIC FUND TRANSFER (NEFT) - AUGUST 2016,,,,,
,Sr. No.,BANK,TOTAL OUTWARD DEBITS,,RECEIVED INWARD CREDITS,
,,,NO. OF TRANSACTIONS,AMOUNT (Rs. Million),NO. OF TRANSACTIONS,AMOUNT (Rs. Million)
,1,ABHYUDAYA CO-OP BANK LTD,40801,2313.26,110826,3789.99
,2,ABU DHABI COMMERCIAL BANK,2815,1611.19,610,804.20
,3,AHMEDABAD MERCANTILE COOP BANK,5419,454.72,15864,1058.53
,4,AKOLA DISTRICT CENTRAL CO-OP BANK,3369,232.89,6569,216.71
,5,ALLAHABAD BANK,1267789,61781.87,2291128,85250.08
,6,ALMORA URBAN CO-OPERATIVE BANK LTD,8777,566.81,12675,519.39
,7,ANDHRA BANK,550958,71352.09,2128731,98389.15
,8,ANDHRA PRAGATHI GRAMEENA BANK,20053,2525.31,52057,2441.96
,9,ANZ Banking Group Limited,24294,7885.06,2714,5022.28
,10,APNA SAHAKARI BANKLTD,6091,423.93,20334,1025.87
,11,AXIS BANK,10156807,590045.78,5175549,487927.51
,12,Akola Janata Commercial Co-Op Bank,4526,532.51,4069,345.69
,13,B N PARIBAS,321154,78575.37,113040,97666.41
,14,BANDHAN BANK LIMITED,55179,2871.88,41720,2126.43
,15,BANK INTERNASIONAL INDONESIA,1554,202.42,45,118.70
,16,BANK OF AMERICA,744802,79176.58,80543,45484.79
,17,BANK OF BAHARIEN AND KUWAIT,32038,2238.85,1662,941.21
,18,BANK OF BARODA,1799150,132517.84,5962715,210494.40
,19,BANK OF CEYLON,1002,49.88,462,128.69
,20,BANK OF INDIA,1416236,71420.94,5012084,198500.58
,21,BANK OF MAHARASHTRA,753885,44740.19,1542148,84106.52
,22,BANK OF NOVA SCOTIA,2756,899.99,985,3391.83
,23,BANK OF TOKYO AND MITSUBISHI,37206,7465.12,5437,9926.93
,24,BARCLAYS BANK,30340,5717.86,1901,4289.80
,25,BASSEIN CATHOLIC CO-OP BANK LTD,9586,773.00,25620,1270.75
,26,BHARAT CO-OP BANK LTD,38620,3444.46,71000,4351.96
,27,BHARATIYA MAHILA BANK LTD,5733,189.43,13949,395.02
,28,CANARA BANK,1534683,155943.74,3431116,192241.67
,29,CAPITAL LOCAL AREA BANK LTD,7605,523.35,9954,1116.09
,30,CATHOLIC SYRIAN BANK LTD.,72376,5619.03,90894,6281.34
,31,CENTRAL BANK OF INDIA,1292940,77453.87,3969949,124661.85
,32,CITI BANK,4288650,647698.35,1756386,434456.92
,33,CITIZEN CREDIT COOPERATIVE BANK LTD,5645,398.05,14528,810.85
,34,CITY UNION BANK LTD,458870,23645.27,358848,21000.84
,35,COMMONWEALTH BANK OF AUSTRALIA,389,24.81,115,261.12
,36,CORPORATION BANK,1311684,94398.63,1879298,131286.31
,37,COSMOS COOPERATIVE BANK,57896,8136.21,116620,8531.42
,38,CREDIT AGRICOLE CORP N INVSMNT BANK,1329,1460.87,211,3979.89
,39,CREDIT SUISSE AG,71,21.91,18,40.04
,40,CTBC BANK CO LTD,493,85.44,197,732.08
,41,DCB BANK LIMITED,135519,8645.93,101252,12736.70
,42,DELHI STATE CO OP BANK LTD,1402,69.36,3323,338.58
,43,DENA BANK,290805,25722.26,828881,48899.58
,44,DEOGIRI NAGARI SAHAKARI BANK LTD,1,0.00,3,0.01
,45,DEUSTCHE BANK,2447252,231651.83,580681,175176.27
,46,DEVELOPMENT BANK OF SINGAPORE,316683,66871.15,30403,18773.97
,47,DHANLAXMI BANK LTD,123365,7244.44,113223,7650.80
,48,DICGC,65,1.88,41,1.74
,49,DOHA BANK QSC,20953,2804.22,528,648.84
,50,DOMBIVLI NAGRIK SAHAKARI BANK,7891,1079.38,24847,1146.64
,51,EXPORT IMPORT BANK OF INDIA,0,0.00,318,746.52
,52,FEDERAL BANK,1356266,75023.08,799198,58910.75
,53,FIRSTRAND BANK,4792,900.20,2270,519.08
,54,GOPINATH PATIL PARSIK JAN SAHA BANK,8464,1258.65,28385,1276.79
,55,GREATER BOMBAY CO-OP BANK,6484,400.78,19178,738.78
,56,HDFC BANK,15833016,1131598.15,9744795,1240810.01
,57,HIMACHAL PRADESH STATE COOPERATIVE,21128,670.12,5259,403.53
,58,HSBC BANK,1570340,233007.47,429770,168377.38
,59,ICICI BANK LTD,9514648,638434.16,7879452,667573.49
,60,IDBI BANK,3366793,195094.90,2332563,275508.05
,61,IDFC BANK LIMITED,16769,41079.19,8484,10452.73
,62,INDIAN BANK,799868,65485.51,2356240,87837.09
,63,INDIAN OVERSEAS BANK,1065068,89636.49,2082318,104272.02
,64,INDUSIND BANK,1439576,127566.94,568137,103176.36
,65,INDUSTRIAL AND COM BANK OF CHINA LT,168,93.66,86,1616.18
,66,INDUSTRIAL BANK OF KOREA,304,86.46,28,274.08
,67,ING VYSYA BANK,2177,17138.19,289199,26566.56
,68,JALGAON JANATA SAHKARI BANK LTD,5063,286.73,6616,415.65
,69,JALGAON PEOPLES COOP BANK LTD,3789,631.97,5507,320.55
,70,JAMMU AND KASHMIR BANK LTD,118267,11159.95,173964,17368.46
,71,JANAKALYAN SAHAKARI BANK LTD,5927,621.50,20653,1042.48
,72,JANATA SAHAKARI BANK LTD,20028,2024.01,39540,2816.90
,73,JANSEVA SAHAKARI BANK BORIVILI LTD,1603,370.87,3750,308.32
,74,JANSEVA SAHAKARI BANK PUNE,4335,194.23,11700,493.18
,75,JP MORGAN BANK,321726,30465.54,7501,23739.91
,76,KALLAPPANNA AWADE IJSB LTD,5709,362.13,7173,631.03
,77,KALUPUR COMM COOPERATIVE BANK,9880,1278.18,35206,2774.51
,78,KALYAN JANATA SAHAKARI BANK,5766,830.87,18886,741.72
,79,KAPOLE BANK,1232,74.86,6689,273.52
,80,KARAD URBAN CO-OP BANK LTD,6771,545.95,12132,776.93
,81,KARNATAKA BANK LTD,288216,16337.03,621198,27792.60
,82,KARNATAKA STATE COOP APEX BANK,21929,558.10,205385,1175.38
,83,KARNATAKA VIKAS GRAMEEN BANK,44539,1301.00,156697,2923.45
,84,KARUR VYSYA BANK,581807,33336.95,732888,49578.49
,85,KOREA EXCHANGE BANK,100,1360.23,229,632.05
,86,KOTAK MAHINDRA BANK LTD,3198750,261471.24,1581349,250915.65
,87,KURMANCHAL NAGAR SAHAKARI BANK,6086,495.02,5339,441.63
,88,Kerala Gramin Bank,42548,3879.85,160363,2480.80
,89,LAKSHMI VILAS BANK LTD,155804,10938.61,189678,14432.66
,90,MAHANAGAR COOP BANK LTD,6570,638.71,19511,1174.64
,91,MAHARASHTRA STATE CO-OP BANK LTD,5322,113.21,6245,1742.17
,92,MASHREQ BANK,442,234.26,34,2.29
,93,MEHSANA URBAN COOPERATIVE BANK LTD,16888,2080.48,15130,1433.66
,94,MIZUHO CORPORATE BANK LTD,12125,5392.03,3410,7335.18
,95,MUMBAI DISTRICT CENTRAL CO-OP. BANK,8561,495.96,11628,1095.02
,96,MUNICIPAL COOP BANK LTD,810,35.21,3157,628.01
,97,NAGAR URBAN COOP BANK LTD,5295,493.27,6016,251.06
,98,NAGPUR NAGRIK SAHAKARI BANK LTD,4999,350.17,7048,560.10
,99,NAINITAL BANK LTD,17144,1266.93,33937,2682.66
,100,NATIONAL AUSTRALIA BANK,1,0.09,13,0.17
,101,NATIONAL BANK OF ABU DHABI PJSC,53,11.24,7,23.35
,102,NEW INDIA CO-OP BANK,7846,458.18,19621,825.08
,103,NKGSB BANK,20770,1496.08,42622,2701.66
,104,NUTAN NAGARIK SAHAKARI BANK LTD,5583,406.47,16861,959.12
,105,ORIENTAL BANK OF COMMERCE,666045,70431.18,1507905,97369.19
,106,PRATHAMA BANK,14385,2105.09,76627,1589.46
,107,PRIME CO-OP BANK LTD. SURAT,5216,401.26,5938,288.76
,108,PUNJAB AND MAHARASHTRA CO BANK,27688,2315.62,92166,4786.61
,109,PUNJAB AND SIND BANK,114983,11344.59,365340,17921.54
,110,PUNJAB NATIONAL BANK,2576540,186182.81,6441539,298245.05
,111,Pragathi Krishna Gramin Bank,140272,5527.19,181468,3526.80
,112,RABOBANK INTERNATIONAL,1289,1239.97,358,1302.68
,113,RAJGURUNAGAR SAHAKARI BANK LTD,3407,194.41,4152,166.18
,114,RAJKOT NAGARIK SAHAKARI BANK LTD,4766,328.57,11441,580.64
,115,"RBI,PAD",5898700,479994.34,28921,75328.00
,116,RBL BANK LTD,431077,22751.87,137967,36831.80
,117,SAMARTH SAHAKARI BANK LTD SOLAPUR,1104,67.38,150,23.34
,118,SARASWAT CO-OP BANK LTD.,141637,12450.18,272999,22952.27
,119,SBER BANK,87,83.30,39,32.81
,120,SEVA VIKAS COOPERATIVE BANK LTD,3731,211.06,7600,937.02
,121,SHAMRAO VITHAL CO-OP BANK LTD,81152,6628.94,139325,10061.82
,122,SHIKSHAK SAHAKARI BANK LTD,2096,2615.77,2702,223.00
,123,SHINHAN BANK,12474,2825.45,5651,3761.73
,124,SHIVALIK MERCANTILE CO-OP BANK,3175,246.63,1013,46.42
,125,SHRI CHHATRAPATI SHAHU URBAN COOP B,3542,197.70,1412,207.53
,126,SOCIETE GENERALE,4874,2853.29,625,1960.63
,127,SOLAPUR JANATA SAHAKARI BANK LTD,3756,683.69,8957,378.91
,128,SOUTH INDIAN BANK,336705,28740.01,502756,31727.16
,129,STANDARD CHARTERED BANK,2698815,282806.08,920580,232702.39
,130,STATE BANK OF BIKANER AND JAIPUR,4727773,42011.24,1526025,40514.94
,131,STATE BANK OF HYDERABAD,2547271,77853.05,1526042,77962.16
,132,STATE BANK OF INDIA,17173994,1267287.12,23108588,1164544.61
,133,STATE BANK OF MAURITIUS,541,123.75,443,574.98
,134,STATE BANK OF MYSORE,442194,32470.80,895209,44026.08
,135,STATE BANK OF PATIALA,620066,45594.53,635423,37505.32
,136,STATE BANK OF TRAVANCORE,852136,50788.06,1559200,59646.09
,137,SUMITOMO MITSUI BANKING CORPORATION,3503,5571.88,447,3067.51
,138,SURAT DISTRICT COOPERATIVE BANK Ltd,2763,226.61,7728,499.46
,139,SURAT NATIONAL CO-OP BANK LTD,1310,138.05,1811,119.17
,140,SURAT PEOPLES COOPERATIVE BANK,5831,404.62,17402,1000.15
,141,SUTEX COOP BANK,2734,180.22,8752,358.01
,142,SYNDICATE BANK,787581,87989.57,1941405,109852.85
,143,TAMIL NADU STATE APEX COOP BANK,29425,1277.08,23960,1604.70
,144,TAMILNADU MERCANTILE BANK,237739,19662.64,327913,21150.37
,145,THANE BHARAT SAHAKARI BANK LTD,3044,684.49,9859,571.95
,146,THANE DISTRICT CENTRAL COOP BANK LT,6726,1762.59,18533,918.30
,147,THANE JANATA SAHAKARI BANK LTD,36323,2788.55,82097,5395.22
,148,THE A. P. MAHESH URBAN CO-OP BANK L,6537,1925.19,11461,768.45
,149,THE AP STATE COOP BANK LTD,19918,1261.61,26025,2556.13
,150,THE GUJARAT STATE CO-OP BANK LTD,17903,1805.06,38998,6969.82
,151,THE HASTI CO-OP. BANK LTD.,1735,109.04,508,34.41
,152,THE KANGRA CENTRAL COOP BANK LTD,18070,556.73,31963,1786.05
,153,THE KANGRA CO OPERATIVE BANK LTD,1723,325.92,5981,171.70
,154,THE NASIK MERCHANTS CO-OP BANK LTD.,8534,573.52,9209,571.57
,155,THE PANDHARPUR URBAN CO-OP BANK,914,56.95,303,48.86
,156,THE RAJASTHAN ST. COOP. BANK LTD,14602,1352.22,205779,879.80
,157,THE ROYAL BANK OF SCOTLAND N.V,64460,8425.65,25643,4135.83
,158,THE SAHEBRAO DESHMUKH COOP BANK LTD,2080,191.43,4991,241.51
,159,THE VARACHHA CO-OP. BANK LTD,3728,806.86,25002,477.29
,160,THE VISHWESHWAR SAHAKARI BANK LTD,5201,573.00,9210,676.53
,161,THE ZOROASTRIAN CO-OP BANK LTD,1795,126.60,2838,211.93
,162,TUMKUR GRAIN MERCHANTS COOP BANK,3002,189.67,2280,188.44
,163,The Gadchiroli Dist Co-Op Bank,3030,67.16,7006,89.44
,164,UCO BANK,513280,50826.01,1709421,74935.99
,165,UNION BANK OF INDIA,1582086,146138.76,3381758,263353.31
,166,UNITED BANK OF INDIA,1014242,36988.47,1898639,60276.45
,167,UNITED OVERSEAS BANK LTD,135,1167.50,106,33.82
,168,VASAI VIKAS SAHAKARI BANK LTD,2159,152.55,6556,340.03
,169,VIJAYA BANK,337264,33847.22,935618,52562.35
,170,WEST BENGAL STATE COOPERATIVE BANK,18904,541.79,108144,3125.33
,171,WESTPAC BANKING CORPORATION,306,45.48,24,25.67
,172,WOORI BANK,950,224.91,276,489.21
,173,YES BANK,4568720,176734.44,955673,163507.36
,174,ZILA SAHKARI BANK LTD GHAZIABAD,978,104.37,5382,110.38
,,Total,118556378,8764139.66,118556378,8764139.66
,,Total (No. of transactions in mn and Amount in bn),118.56,8764.14,118.56,8764.14
